{
  "$schema": "https://json-schema.org/draft/2020-12/schema",
  "title": "DeckFile",
  "description": "A story chapter's outer-layer cards (design doc 4.2 and 7.2, build plan P1): the 2 to 3 cards played before the chapter opens, and the event cards a Trigger with event \"card\" shows inside it. Card and option text is in content/strings under deck.<chapter>.<card>.title, deck.<chapter>.<card>.<option> and deck.<chapter>.<card>.<option>.note. Cross-file checks (the chapter exists, effects name card or event tags, every combination of opening cards can finish the chapter) are in tools/check-decks.ts.",
  "type": "object",
  "additionalProperties": false,
  "required": ["version", "chapter", "opening", "events"],
  "properties": {
    "version": { "const": 1 },
    "chapter": { "description": "The chapter id; also the file name.", "type": "string", "pattern": "^[a-z][a-z0-9-]*$" },
    "opening": {
      "description": "Played in order before the first room. Empty for a chapter whose premise is fixed (the prologue).",
      "type": "array",
      "maxItems": 3,
      "items": { "$ref": "#/$defs/Card" }
    },
    "events": {
      "description": "Shown when the operator steps on a Trigger whose event is card and whose eventId is the card id.",
      "type": "array",
      "items": { "$ref": "#/$defs/Card" }
    },
    "closing": {
      "description": "Played in order after the chapter ends, before the next chapter (design doc 7.3: the prologue ends on \"what time tonight?\"). Their effects are what the run carries into the next chapter, which then skips its own opening cards of the same id.",
      "type": "array",
      "maxItems": 3,
      "items": { "$ref": "#/$defs/Card" }
    }
  },
  "$defs": {
    "Card": {
      "type": "object",
      "additionalProperties": false,
      "required": ["id", "options"],
      "properties": {
        "id": { "type": "string", "pattern": "^[a-z][a-z0-9_]*$" },
        "options": { "type": "array", "minItems": 2, "maxItems": 3, "items": { "$ref": "#/$defs/Option" } }
      }
    },
    "Option": {
      "type": "object",
      "additionalProperties": false,
      "required": ["id", "effect"],
      "properties": {
        "id": { "type": "string", "pattern": "^[a-z][a-z0-9_]*$" },
        "effect": { "description": "What choosing it does, in the effect language of the dialogue CSV: tag:x, tag:x=n, tag:x+n, clock:minutes, unlock:page, separated by ;. Empty does nothing. Opening cards may set tags whose sources include card, event cards those whose sources include event.", "type": "string" }
      }
    }
  }
}
