{
  "version": 1,
  "chapter": "brain",
  "opening": [
    {
      "id": "bedtime",
      "options": [
        { "id": "at_23", "effect": "" },
        { "id": "at_01", "effect": "tag:sleep_debt=2" },
        { "id": "at_03", "effect": "tag:sleep_debt=4" }
      ]
    },
    {
      "id": "morning_coffee",
      "options": [
        { "id": "drink", "effect": "tag:caffeine=100" },
        { "id": "skip", "effect": "" }
      ]
    }
  ],
  "events": [
    {
      "id": "group_chat",
      "options": [
        { "id": "rewrite", "effect": "tag:deadline;clock:60;tag:exam_practice=95" },
        { "id": "office_hour", "effect": "tag:stress+10;tag:exam_practice=60" }
      ]
    }
  ]
}
